{
  "schema_version": "1.0.0",
  "artifact": "requirements-matrix",
  "run_id": "RUN-20260601-142802",
  "generated_at": "2026-06-01T14:28:02+08:00",
  "producer": {
    "agent": "Requirement Evidence Agent",
    "version": "1.0.0"
  },
  "inputs": [
    {
      "artifact": "requirements",
      "path": "output/records/requirements.json",
      "schema_version": "1.0.0"
    }
  ],
  "rows": [
    {
      "source_id": "T001",
      "source_type": "requirement",
      "title": "海图综合态势展示-标准符合性",
      "target_sections": [
        "功能设计"
      ],
      "planned_module_ids": [
        "M001"
      ],
      "planned_diagram_ids": [
        "DG001"
      ],
      "coverage_status": "planned",
      "notes": [
        "强制/应答条款",
        "建议在设计阶段规划图表"
      ]
    },
    {
      "source_id": "T002",
      "source_type": "requirement",
      "title": "海图综合态势展示",
      "target_sections": [
        "功能设计"
      ],
      "planned_module_ids": [
        "M002"
      ],
      "planned_diagram_ids": [
        "DG002"
      ],
      "coverage_status": "planned",
      "notes": [
        "建议在设计阶段规划图表"
      ]
    },
    {
      "source_id": "T003",
      "source_type": "requirement",
      "title": "海图综合态势展示",
      "target_sections": [
        "功能设计"
      ],
      "planned_module_ids": [
        "M003"
      ],
      "planned_diagram_ids": [
        "DG003"
      ],
      "coverage_status": "planned",
      "notes": [
        "强制/应答条款",
        "建议在设计阶段规划图表"
      ]
    },
    {
      "source_id": "T004",
      "source_type": "requirement",
      "title": "海图综合态势展示",
      "target_sections": [
        "功能设计"
      ],
      "planned_module_ids": [
        "M004"
      ],
      "planned_diagram_ids": [
        "DG004"
      ],
      "coverage_status": "planned",
      "notes": [
        "建议在设计阶段规划图表"
      ]
    },
    {
      "source_id": "T005",
      "source_type": "requirement",
      "title": "AIS/雷达等目标信息的处理与显示",
      "target_sections": [
        "功能设计"
      ],
      "planned_module_ids": [
        "M005"
      ],
      "planned_diagram_ids": [
        "DG005"
      ],
      "coverage_status": "planned",
      "notes": [
        "建议在设计阶段规划图表"
      ]
    },
    {
      "source_id": "T006",
      "source_type": "requirement",
      "title": "AIS/雷达等目标信息的处理与显示",
      "target_sections": [
        "功能设计"
      ],
      "planned_module_ids": [
        "M006"
      ],
      "planned_diagram_ids": [
        "DG006"
      ],
      "coverage_status": "planned",
      "notes": [
        "建议在设计阶段规划图表"
      ]
    },
    {
      "source_id": "T007",
      "source_type": "requirement",
      "title": "AIS/雷达等目标信息的处理与显示",
      "target_sections": [
        "功能设计"
      ],
      "planned_module_ids": [
        "M007"
      ],
      "planned_diagram_ids": [
        "DG007"
      ],
      "coverage_status": "planned",
      "notes": [
        "建议在设计阶段规划图表"
      ]
    },
    {
      "source_id": "T008",
      "source_type": "requirement",
      "title": "AIS/雷达等目标信息的处理与显示",
      "target_sections": [
        "功能设计"
      ],
      "planned_module_ids": [
        "M008"
      ],
      "planned_diagram_ids": [
        "DG008"
      ],
      "coverage_status": "planned",
      "notes": [
        "建议在设计阶段规划图表"
      ]
    },
    {
      "source_id": "T009",
      "source_type": "requirement",
      "title": "AIS/雷达等目标信息的处理与显示",
      "target_sections": [
        "功能设计"
      ],
      "planned_module_ids": [
        "M009"
      ],
      "planned_diagram_ids": [
        "DG009"
      ],
      "coverage_status": "planned",
      "notes": [
        "建议在设计阶段规划图表"
      ]
    },
    {
      "source_id": "T010",
      "source_type": "requirement",
      "title": "航线规划",
      "target_sections": [
        "功能设计"
      ],
      "planned_module_ids": [
        "M010"
      ],
      "planned_diagram_ids": [
        "DG010"
      ],
      "coverage_status": "planned",
      "notes": [
        "建议在设计阶段规划图表"
      ]
    },
    {
      "source_id": "T011",
      "source_type": "requirement",
      "title": "航线规划",
      "target_sections": [
        "功能设计",
        "安全设计"
      ],
      "planned_module_ids": [
        "M011"
      ],
      "planned_diagram_ids": [
        "DG011"
      ],
      "coverage_status": "planned",
      "notes": [
        "建议在设计阶段规划图表"
      ]
    },
    {
      "source_id": "T012",
      "source_type": "requirement",
      "title": "航线规划",
      "target_sections": [
        "功能设计",
        "安全设计"
      ],
      "planned_module_ids": [
        "M012"
      ],
      "planned_diagram_ids": [
        "DG012"
      ],
      "coverage_status": "planned",
      "notes": [
        "建议在设计阶段规划图表"
      ]
    },
    {
      "source_id": "T013",
      "source_type": "requirement",
      "title": "航线规划",
      "target_sections": [
        "功能设计"
      ],
      "planned_module_ids": [
        "M013"
      ],
      "planned_diagram_ids": [
        "DG013"
      ],
      "coverage_status": "planned",
      "notes": [
        "建议在设计阶段规划图表"
      ]
    },
    {
      "source_id": "T014",
      "source_type": "requirement",
      "title": "航线规划",
      "target_sections": [
        "功能设计"
      ],
      "planned_module_ids": [
        "M014"
      ],
      "planned_diagram_ids": [
        "DG014"
      ],
      "coverage_status": "planned",
      "notes": [
        "建议在设计阶段规划图表"
      ]
    },
    {
      "source_id": "T015",
      "source_type": "requirement",
      "title": "航线规划",
      "target_sections": [
        "功能设计"
      ],
      "planned_module_ids": [
        "M015"
      ],
      "planned_diagram_ids": [
        "DG015"
      ],
      "coverage_status": "planned",
      "notes": [
        "建议在设计阶段规划图表"
      ]
    },
    {
      "source_id": "T016",
      "source_type": "requirement",
      "title": "安全等深线与水深告警",
      "target_sections": [
        "功能设计",
        "安全设计"
      ],
      "planned_module_ids": [
        "M016"
      ],
      "planned_diagram_ids": [
        "DG016"
      ],
      "coverage_status": "planned",
      "notes": [
        "建议在设计阶段规划图表"
      ]
    },
    {
      "source_id": "T017",
      "source_type": "requirement",
      "title": "安全等深线与水深告警",
      "target_sections": [
        "功能设计",
        "安全设计"
      ],
      "planned_module_ids": [
        "M017"
      ],
      "planned_diagram_ids": [
        "DG017"
      ],
      "coverage_status": "planned",
      "notes": [
        "建议在设计阶段规划图表"
      ]
    },
    {
      "source_id": "T018",
      "source_type": "requirement",
      "title": "安全等深线与水深告警",
      "target_sections": [
        "功能设计",
        "安全设计"
      ],
      "planned_module_ids": [
        "M018"
      ],
      "planned_diagram_ids": [
        "DG018"
      ],
      "coverage_status": "planned",
      "notes": [
        "强制/应答条款",
        "建议在设计阶段规划图表"
      ]
    },
    {
      "source_id": "T019",
      "source_type": "requirement",
      "title": "安全等深线与水深告警",
      "target_sections": [
        "功能设计"
      ],
      "planned_module_ids": [
        "M019"
      ],
      "planned_diagram_ids": [
        "DG019"
      ],
      "coverage_status": "planned",
      "notes": [
        "建议在设计阶段规划图表"
      ]
    },
    {
      "source_id": "T020",
      "source_type": "requirement",
      "title": "安全等深线与水深告警",
      "target_sections": [
        "功能设计",
        "安全设计"
      ],
      "planned_module_ids": [
        "M020"
      ],
      "planned_diagram_ids": [
        "DG020"
      ],
      "coverage_status": "planned",
      "notes": [
        "建议在设计阶段规划图表"
      ]
    },
    {
      "source_id": "T021",
      "source_type": "requirement",
      "title": "安全等深线与水深告警",
      "target_sections": [
        "功能设计"
      ],
      "planned_module_ids": [
        "M021"
      ],
      "planned_diagram_ids": [
        "DG021"
      ],
      "coverage_status": "planned",
      "notes": [
        "建议在设计阶段规划图表"
      ]
    },
    {
      "source_id": "T022",
      "source_type": "requirement",
      "title": "航行监控导航与安全预警",
      "target_sections": [
        "功能设计"
      ],
      "planned_module_ids": [
        "M022"
      ],
      "planned_diagram_ids": [
        "DG022"
      ],
      "coverage_status": "planned",
      "notes": [
        "建议在设计阶段规划图表"
      ]
    },
    {
      "source_id": "T023",
      "source_type": "requirement",
      "title": "航行监控导航与安全预警",
      "target_sections": [
        "功能设计"
      ],
      "planned_module_ids": [
        "M023"
      ],
      "planned_diagram_ids": [
        "DG023"
      ],
      "coverage_status": "planned",
      "notes": [
        "建议在设计阶段规划图表"
      ]
    },
    {
      "source_id": "T024",
      "source_type": "requirement",
      "title": "航行监控导航与安全预警",
      "target_sections": [
        "功能设计"
      ],
      "planned_module_ids": [
        "M024"
      ],
      "planned_diagram_ids": [
        "DG024"
      ],
      "coverage_status": "planned",
      "notes": [
        "建议在设计阶段规划图表"
      ]
    },
    {
      "source_id": "T025",
      "source_type": "requirement",
      "title": "航行监控导航与安全预警",
      "target_sections": [
        "功能设计"
      ],
      "planned_module_ids": [
        "M025"
      ],
      "planned_diagram_ids": [
        "DG025"
      ],
      "coverage_status": "planned",
      "notes": [
        "建议在设计阶段规划图表"
      ]
    },
    {
      "source_id": "T026",
      "source_type": "requirement",
      "title": "个性化设置需求",
      "target_sections": [
        "功能设计"
      ],
      "planned_module_ids": [
        "M026"
      ],
      "planned_diagram_ids": [
        "DG026"
      ],
      "coverage_status": "planned",
      "notes": [
        "建议在设计阶段规划图表"
      ]
    },
    {
      "source_id": "T027",
      "source_type": "requirement",
      "title": "个性化设置需求",
      "target_sections": [
        "功能设计"
      ],
      "planned_module_ids": [
        "M027"
      ],
      "planned_diagram_ids": [
        "DG027"
      ],
      "coverage_status": "planned",
      "notes": [
        "强制/应答条款",
        "建议在设计阶段规划图表"
      ]
    },
    {